{
  "schema": 1,
  "version": "2026.10.25",
  "sha256": "0000000000000000000000000000000000000000000000000000000000000000",
  "device": "Anbernic RG40XX-H",
  "cfw": "muOS 2502.0",
  "resolution": "640x480",
  "tests": [
    "launch",
    "warm-start",
    "patches-installed",
    "conversion-5093-files-0-missing-0-changed"
  ],
  "verifiedUtc": "2026-10-25T12:00:00Z",
  "notes": "Replace sha256 with the artifact's sha256. This example is not a valid receipt."
}
